Duddleswell,M1
"Made by High Weald Dairy in Sussex.
",M1
Duddleswell is a full fat hard cheese,M2
"made from pasteurised Sheep milk.
",M2
"It is a well rounded, rich flavoured cheese, with a  mildly acidic taste incorporating ewes milk character, sweet and buttery notes.",M2
"Once made, the cheese is matured in carefully controlled conditions, and turned daily for up to five months, until each batch is graded, ready for sale, by the cheese maker.",M3
The resulting cheese has a smooth creamy texture,M2
and delicious nutty flavour.,M2
"The cheese is available in both a standard and Organic format as well as Oak Smoked versions of both.

Nutritional Information - Duddleswell contains 35% Fat, 24% Protein, 3% carbohydrate, 2% Fibre, 1.65% Salt, 443 Kcal/100 g",M2
