Gruyere,M1
Originally made in the Swiss town of the same name,M3
"Gruyere is quite similar to Emmental, but has smaller and fewer holes",M2
 The name Gruyere - accompanied by its origin - either French or Swiss - is now a protected name and existing producers of Gruyere Cheese not in one of the designated areas of production are only allowed to use the name for few more years.,M2
British Gruyere is made in Cheshire,M3
"It has a firm, chewy texture",M2
and a slightly tangy flavour that adds a delicious zest when used in cooking,M2
"This cheese is used as an ingredient in prepared food dishes and sandwiches.
",M5
