Red Fox,M1
A brand of cheese made by Belton Farm,M1
Red Fox is a modern British classic with a cunningly unexpected crunch!,M2
"Handmade using a unique recipe developed over many years along with carefully selected starter cultures,",M3
the cheese has an intense and complex blend of sweet and savoury flavours.,M2
The russet colour comes from the addition of annatto to the milk and the crunch from the naturally occurring calcium lactate crystals which form as the cheese matures.,M2
Red Fox is typically aged for between 14 and 18 months. ,M3
