Village Green,M1
"Made by Milk Link Cheese (now part of ARLA Foods) at their Reece's Creamery in Malpas, Cheshire",M1
 Village Green is a cheddar style cheese,M2
made from goat's milk,M2
Its name reflects the green wax coating applied to every cheese,M2
Sold at various ages between 3 months and 18 months,M3
it has a brilliant white colour,M2
and sweet nutty flavour that becomes more pronounced as it ages.,M2
"If you thought you didn't like goat's cheese then this is the one that might change your mind!
",M2
